{
  "metadata": {
    "max_time_steps": 150,
    "description": "Level 2: three drive units on a 3x3 grid where every aisle has capacity 1. Six pods from two storage corners to two station corners force assignment and congestion decisions around the center."
  },
  "nodes": [
    {"id": 0, "name": "Storage-NW", "type": "storage"},
    {"id": 1, "name": "Aisle-N", "type": "travel"},
    {"id": 2, "name": "Station-NE", "type": "station"},
    {"id": 3, "name": "Aisle-W", "type": "travel"},
    {"id": 4, "name": "Center", "type": "travel"},
    {"id": 5, "name": "Aisle-E", "type": "travel"},
    {"id": 6, "name": "Storage-SW", "type": "storage"},
    {"id": 7, "name": "Aisle-S", "type": "travel"},
    {"id": 8, "name": "Station-SE", "type": "station"}
  ],
  "edges": [
    {"from_node": 0, "to_node": 1, "weight": 2, "capacity": 1},
    {"from_node": 1, "to_node": 2, "weight": 2, "capacity": 1},
    {"from_node": 3, "to_node": 4, "weight": 2, "capacity": 1},
    {"from_node": 4, "to_node": 5, "weight": 2, "capacity": 1},
    {"from_node": 6, "to_node": 7, "weight": 2, "capacity": 1},
    {"from_node": 7, "to_node": 8, "weight": 2, "capacity": 1},
    {"from_node": 0, "to_node": 3, "weight": 2, "capacity": 1},
    {"from_node": 3, "to_node": 6, "weight": 2, "capacity": 1},
    {"from_node": 1, "to_node": 4, "weight": 2, "capacity": 1},
    {"from_node": 4, "to_node": 7, "weight": 2, "capacity": 1},
    {"from_node": 2, "to_node": 5, "weight": 2, "capacity": 1},
    {"from_node": 5, "to_node": 8, "weight": 2, "capacity": 1}
  ],
  "drive_units": [
    {"id": 0, "start_node": 0},
    {"id": 1, "start_node": 6},
    {"id": 2, "start_node": 3}
  ],
  "pods": [
    {"id": "P1", "source_node": 0, "destination_station": 2, "entry_time": 0},
    {"id": "P2", "source_node": 0, "destination_station": 8, "entry_time": 0},
    {"id": "P3", "source_node": 6, "destination_station": 2, "entry_time": 0},
    {"id": "P4", "source_node": 6, "destination_station": 8, "entry_time": 4},
    {"id": "P5", "source_node": 0, "destination_station": 2, "entry_time": 8},
    {"id": "P6", "source_node": 6, "destination_station": 8, "entry_time": 8}
  ]
}
