{
  "metadata": {
    "max_time_steps": 60,
    "description": "Level 1: single drive unit, single pod. The direct aisle to the station is long; the three-hop path is shorter. Tests weighted shortest path over greedy edge selection."
  },
  "nodes": [
    {"id": 0, "name": "Storage-A", "type": "storage"},
    {"id": 1, "name": "Aisle-1", "type": "travel"},
    {"id": 2, "name": "Aisle-2", "type": "travel"},
    {"id": 3, "name": "Station-1", "type": "station"}
  ],
  "edges": [
    {"from_node": 0, "to_node": 3, "weight": 10},
    {"from_node": 0, "to_node": 1, "weight": 2},
    {"from_node": 1, "to_node": 2, "weight": 2},
    {"from_node": 2, "to_node": 3, "weight": 2}
  ],
  "drive_units": [
    {"id": 0, "start_node": 0}
  ],
  "pods": [
    {"id": "P1", "source_node": 0, "destination_station": 3, "entry_time": 0}
  ]
}
